{
  "schemaVersion": "0.1.0",
  "scope": "selective-context",
  "lastUpdatedOn": "2026-10-19",
  "boundaryNote": "This curated research watchlist contains official public items selected for topical relevance to one or more directives even though the reviewed item does not currently meet the Atlas evidence rule. It is selective, not comprehensive or live. Editorial relevance does not establish causation, implementation activity, progress, completion, compliance, or performance. Omission has no negative meaning.",
  "items": [
    {
      "id": "ctc-2026-08-03-sccp-north-hearing",
      "kind": "publication-checkpoint",
      "title": "North Hearing for the Proposed 2026 Solutions for Congested Corridors Program (SCCP) Guidelines",
      "titleOrigin": "publisher",
      "publisher": "California Transportation Commission",
      "url": "https://catc.ca.gov/-/media/ctc-media/documents/programs/sccp/final-north-sccp-hearing-agenda-a11y.pdf",
      "mediaType": "application/pdf",
      "relatedUrls": [
        {
          "label": "California Transportation Commission meeting schedule",
          "url": "https://catc.ca.gov/meetings-events/commission-meetings"
        }
      ],
      "sourceDate": {
        "value": "2026-08-03",
        "kind": "scheduled-event",
        "origin": "artifact-header"
      },
      "retrievedOn": "2026-10-19",
      "lastReviewedOn": "2026-10-19",
      "editorialSummary": "The Commission agenda scheduled a northern hearing on the proposed 2026 Solutions for Congested Corridors Program guidelines for August 3, 2026. The Commission's August 20–21, 2026 meeting book items state that the North Hearing was held on that date. The Commission's meetings page now lists the hearing's presentation and a recording link beside the agenda. The presentation cites Order 5 and is recorded in the evidence register; the recording was not reviewed.",
      "whyTracked": "Directive 5 names the Solutions for Congested Corridors Program among the state funding programs whose guidelines are to be updated. The adoption book item that followed the hearing and the hearing presentation are in the evidence register; this lead now watches for a hearing record or adopted resolution text that documents the outcome.",
      "evidenceBoundary": {
        "reason": "no-explicit-order-citation",
        "checkedOn": "2026-10-19",
        "explicitOrderCitation": false,
        "note": "The agenda, re-read on 2026-10-19, does not cite N-7-26, Executive Order N-7-26, or Order 5, and it does not record an adoption or hearing outcome. The hearing presentation that does cite Order 5 is a separate artifact with its own evidence record. The recording listed on the Commission's meetings page was not reviewed, so this note makes no statement about it."
      },
      "directiveLinks": [
        {
          "directiveId": "n-7-26-5",
          "relationship": "process-adjacency",
          "rationale": "The scheduled hearing concerns proposed guidelines for a funding program explicitly named in directive 5."
        }
      ],
      "nextReviewOn": "2026-12-07",
      "watchFor": [
        "A hearing record or the text of adopted Resolution G-26-60 that explicitly cites N-7-26.",
        "Language showing whether the July 15 transit-priority and first- and last-mile proposals were retained in the adopted guidelines."
      ],
      "limitations": [
        "A scheduled hearing does not establish that any proposal was retained or that guidelines were adopted; the statement that the hearing occurred comes from a later staff memorandum, not from this agenda.",
        "The hearing recording was listed on the Commission's meetings page but was not viewed or transcribed for this review."
      ],
      "lastObservation": {
        "sha256": "91824b9527422e49174641285c4d33b8e9a87153692d565e7060db076b303374",
        "basis": "bytes",
        "mentionsOrder": null,
        "observedOn": "2026-10-19"
      }
    },
    {
      "id": "ctc-2026-08-20-21-meeting-materials-watch",
      "kind": "publication-checkpoint",
      "title": "California Transportation Commission meeting — August 20–21, 2026",
      "titleOrigin": "editorial",
      "publisher": "California Transportation Commission",
      "url": "https://catc.ca.gov/meetings-events/commission-meetings/2026-08-20-21",
      "mediaType": "text/html",
      "relatedUrls": [
        {
          "label": "Solutions for Congested Corridors Program",
          "url": "https://catc.ca.gov/programs/sb1/solutions-for-congested-corridors-program"
        },
        {
          "label": "Local Partnership Program",
          "url": "https://catc.ca.gov/programs/sb1/local-partnership-program"
        }
      ],
      "sourceDate": {
        "value": "2026-08-20",
        "kind": "scheduled-event",
        "origin": "page-header"
      },
      "retrievedOn": "2026-10-19",
      "lastReviewedOn": "2026-10-19",
      "editorialSummary": "The Commission's page for its August 20–21, 2026 meeting lists the agenda, the complete meeting book, individual book items, supplemental letters, presentations, a draft change list and webcast recordings for both days. The book items for the 2026 SCCP and Local Partnership Competitive Program guidelines adoptions cite Order 5 and are recorded in the evidence register; the page itself, the agenda, and the change list do not cite the order. Minutes are not on this page, but the Commission's October 15–16, 2026 meeting materials include them, published October 2, 2026 for approval, and they list Resolutions G-26-60 and G-26-64 as approved without citing the order.",
      "whyTracked": "The two guideline-adoption book items for programs named in directive 5 are now evidence records. This page remains the publication checkpoint for the text of adopted resolutions G-26-60 and G-26-64 and for the final guidelines, which would document what was adopted.",
      "evidenceBoundary": {
        "reason": "no-explicit-order-citation",
        "checkedOn": "2026-10-19",
        "explicitOrderCitation": false,
        "note": "The meeting page, agenda, and draft change list re-read on 2026-10-19 do not cite N-7-26, Executive Order N-7-26, or Order 5, and neither do the August 20–21 minutes it leads to. The individual book items that do cite the order are separate artifacts with their own evidence records; this lead stays context-only because the page carries no resolution text or final guidelines."
      },
      "directiveLinks": [
        {
          "directiveId": "n-7-26-5",
          "relationship": "publication-watch",
          "rationale": "The page may later publish final or adopted SCCP and Local Partnership Program materials for programs named in directive 5."
        }
      ],
      "nextReviewOn": "2026-12-07",
      "watchFor": [
        "The text of adopted resolutions G-26-60 and G-26-64, or the final guidelines, explicitly citing N-7-26.",
        "An exact locator for any Order 5 guideline language in the final guidelines."
      ],
      "limitations": [
        "The existence of a meeting page with staff recommendations does not establish that any item was heard or adopted as proposed.",
        "The displayed date is the scheduled first day of a two-day meeting.",
        "The minutes were published for approval at the October 15–16 meeting. The materials reviewed do not say whether the minutes were approved."
      ],
      "lastObservation": {
        "sha256": "06916896d7fb7c45b0685881feb9a702dd61a0b4e1d624e0566d039afff972d4",
        "basis": "text",
        "mentionsOrder": false,
        "observedOn": "2026-10-19"
      }
    },
    {
      "id": "fta-2026-07-27-bus-low-no-nofo",
      "kind": "context-source",
      "title": "FY 2026 Notice of Funding Opportunity: Grants for Buses and Bus Facilities Infrastructure Programs",
      "titleOrigin": "publisher",
      "publisher": "Federal Transit Administration",
      "url": "https://www.transit.dot.gov/notices-funding/fy-2026-notice-funding-opportunity-grants-buses-and-bus-facilities-infrastructure",
      "mediaType": "text/html",
      "relatedUrls": [
        {
          "label": "Federal Register notice",
          "url": "https://www.govinfo.gov/content/pkg/FR-2026-07-27/pdf/2026-15090.pdf"
        }
      ],
      "sourceDate": {
        "value": "2026-07-27",
        "kind": "published",
        "origin": "page-header"
      },
      "retrievedOn": "2026-10-19",
      "lastReviewedOn": "2026-10-19",
      "editorialSummary": "FTA announced approximately $21 million for the FY 2026 Buses and Bus Facilities Program and approximately $589 million for the FY 2026 Low or No Emission Program. The page lists the opportunity as closed on September 21, 2026, the application deadline, and states that FTA will make selections within 75 days of that date. No selections were announced on the page at the October 19, 2026 review.",
      "whyTracked": "Directive 5 directs Caltrans to identify federal funding programs for transit-priority infrastructure and first- and last-mile projects. This new federal opportunity is a plausible program for later California guidance or identification, subject to project eligibility and scope.",
      "evidenceBoundary": {
        "reason": "no-explicit-order-citation",
        "checkedOn": "2026-10-19",
        "explicitOrderCitation": false,
        "note": "The federal notice, re-read on 2026-10-19, does not cite N-7-26 and does not mention California, Caltrans or CalSTA. It is not a Caltrans or CalSTA identification action under directive 5."
      },
      "directiveLinks": [
        {
          "directiveId": "n-7-26-5",
          "relationship": "topic-alignment",
          "rationale": "The opportunity funds buses and supporting facilities and may become relevant to directive 5's federal-program-identification clause."
        }
      ],
      "nextReviewOn": "2026-12-07",
      "watchFor": [